"縣市","選區","號次","姓名","生日","性別","出生地","政黨",學歷,"經歷"
"桃園市",1,1,"陳根德",45/1/18,"男","桃園市","中國國民黨","1. 元智大學社會暨政策科
學學系碩士班社會學碩士
學位","第四至八屆立法委員。救國團桃園
縣團委會及復興活動中心主委。桃
園農工崇學基金會董事長。臺灣省
義勇人員安全濟助基金會董事。桃
園縣議會議長。中華民國及桃園縣
後備憲兵荷松協會理事長。桃園縣
體育會理事長。桃園縣民眾服務社
理事長。桃園縣義警大隊大隊長。"
"桃園市",1,2,"鄭運鵬",62/6/2,"男","臺北市","民主進步黨","國立臺灣大學土木工程學
系畢業、私立延平中學高
中部、私立延平中學國中
部、台北市立福星國民小
學","第六、九屆立法委員、民主進步黨
立院黨團書記長、民主進步黨發言
人、民主進步黨文化宣傳部主任、
民主進步黨組織擴廣部主任、高雄
市工務局機要秘書"
"桃園市",1,3,"楊淂鉉",81/4/11,"男","新北市","無","淡江大學歷史學系學士
國立瑞芳高工綜合高中科
溪崑國中
頂埔國小","核四三千億債務人
前瞻八千八百億債務人
風力發電兩兆債務人
俄羅斯輪盤電力版本被迫參與者
無核家園用肺空氣清淨被迫參與者"
"桃園市",1,4,"陳泓維",76/5/8,"男","桃園市","台灣民眾黨","成功工商","龍華科技大學文創系、優佳達多媒
體工作室負責人、聯合速攝商業攝
影工作室負責人、碩盟通信有限公
司負責人、碩盟餐飲有限公司負責
人"
"桃園市",1,5,"沈育和",52/11/12,"男","臺南市","一邊一國行動黨","台南市立鹽水國中畢","桃園市道教會監事
桃園南天武聖殿 殿主－悟道法師
宏竹社區發展協會顧問
大華國小顧問"
"桃園市",2,1,"黃世杰",68/1/5,"男","臺北市","民主進步黨","美國哥倫比亞大學 法學碩士
台灣大學 法學碩士
台灣大學 法律、社會雙學士
建國中學
復旦中學國中部","2001 年 律師高考第一名
2001 年 司法官特考及格
桃園市政府 參議、顧問
桃園市客家文化基金會 監察人
財團法人農業工程研究中心 董事"
"桃園市",2,2,"吳文凱",69/10/25,"男","桃園市","台灣維新","潮音國小
大園國中
清雲技術學院 機械科
中國文化大學 政治學系","德商光電設備主任
人力仲介事務人員"
"桃園市",2,3,"陳志豪",67/5/16,"男","屏東縣","中華統一促進黨","桃園市治平中學畢業","1. 經營不動產仲介買賣18 年
2. 亞力山大健身中心店經理
3. 中華統一促進黨楊業黨部主委"
"桃園市",2,4,"張馨云",58/7/23,女,"桃園市","台澎黨","淡江大學畢","力堂實業有限公司前負責人
台名保險經紀人( 股) 公司業務經理
保險經紀人國家考試榜首
富馨保險經紀人事務所負責人
中華民國保險經紀人公會監事"
"桃園市",2,5,"吳志揚",58/2/8,"男","桃園市","中國國民黨","1. 哈佛大學法學碩士。
2. 臺灣大學法學碩士。
3. 臺灣大學法律系司法組第一名。","1. 中華職業棒球大聯盟會長。
2. 第六、七、九屆立法委員。
3. 國際佛光會世界總會法制長。
4. 國立體育大學博士生。
5. 桃園縣縣長。
6. 中原大學榮譽教授。
7. 臺灣警察專科學校榮譽教授。
8. 執業律師。"
"桃園市",3,1,"胡文中",54/10/30,女,"臺北市","中華文化復興在理黨","國立成功大學化學工程學
系學士畢

美國康乃迪克大學化學工
程學系博士畢","工業技術研究院化學工業研究所
光電組經理

遠東新世紀光學膜事業群
協理"
"桃園市",3,2,"魯明哲",52/12/4,"男","臺北市","中國國民黨","元智大學管理碩士
政治大學企管學士","現任桃園市議員
第12 屆中壢市長
第15、16 屆桃園縣議員
第9 屆中壢市民代表"
"桃園市",3,3,"李奇峰",78/8/24,"男","新北市","宗教聯盟","輔仁大學宗教研究所畢業","曾任；
自由時報風水專欄 老師
台灣珠寶雜誌專欄 作家
《原來風水這樣看》作家
台灣金銀珠寶協會專欄 作家
輔仁大學宗教學系第六屆宗教博覽會 籌備委員
108 台灣宗教敬天祈福大法會閭山道法副總監
現任；
國際同濟會北二區飛揚會會長
天公教道法學院院"
"桃園市",3,4,"彭俊豪",71/8/15,"男","桃園市","民主進步黨","英國南安普敦大學社會科學碩士","桃園市第一屆、二屆 市議員
健行科技大學 講師
桃園市體育會輕艇委員會 理事長
中華象棋促進協會 理事長
桃園太極氣功十八式協會 理事長
桃園市議會民進黨黨團 幹事長
民進黨桃園市黨部 執、評委
桃園市滑板體育委員會 副主委
中壢壢民獅子會 創會長
英國南安普敦大學台灣學生會 副會長
桃園縣儀隊發展協會 常務理事"
"桃園市",3,5,"林佳瑋",75/2/18,女,"嘉義市","時代力量","政治大學社會學系學士
台灣大學建築與城鄉研究所碩士","桃園市產業總工會秘書長
桃園市空服員職業工會秘書長
中華民國全國航空業總工會顧問
中華民國消防員工作權益促進會顧問"
"桃園市",3,6,"李文雄",46/2/16,"男","高雄市","無","美國休士頓大學財務金融
博士
臺灣大學商學研究所碩士
政治大學企業管理系學士","土銀保險經紀股份有限公司董事長
土地銀行常務董事
健行科技大學財務金融系副教授
金融監督管理委員會銀行局組長
財政部金融局組長"
"桃園市",4,1,"林國政",55/4/27,"男","臺中市","國會政黨聯盟","銘傳大學碩士、國防大學
理工學院","銘傳大學博士生、臺灣政治研究員
、銘傳大學民主法治講師、桃園社
區大學主任兼講師、桃園市政府區
政諮詢委員、二屆市民代表、一屆
里長、二屆國民黨全國黨代表、宋
楚瑜十四屆總統大選桃園競選總部
執行長、吳志揚95 年立委駐區秘
書、行政院防疫講師十年捐贈幼兒
園及社區千萬元超次亞水防治流感"
"桃園市",4,2,"李中",66/12/15,女,"臺北市","勞動黨","大葉大學食品工程學系學士","勞動黨中央委員
台灣地區政治受難人互助會常務委員"
"桃園市",4,3,"吳清江",52/4/18,女,"桃園市","合一行動聯盟","國立臺灣大學農藝系畢業","美國猶他州立偉伯大學畢業
傳播/ 英文/ 心理系
美夏威夷州萬國大學碩士班修習
青年使命團門徒訓練學校 校長/
講師/ 口譯
愛修園領袖學院道學碩士文憑
愛修園領袖學院實用教牧博士文憑"
"桃園市",4,4,"萬美玲",58/9/25,女,"臺北市","中國國民黨","美國明尼蘇達州立曼徹普利敦大學","廣州暨南大學國際關係研究所碩士
桃園縣第15.16.17屆縣議員
桃園市第1.2.屆市議員
桃園市議會教育審查小組召集人
朱立倫競選總統辦公室新聞發言人
中山國小家長會長
中興國中管樂班後援會會長
兒童少年保護協會理事長
桃園區女青年會理事長
婦女企管協會理事長
嘉義同鄉會副理事長
江西同鄉會理事長"
"桃園市",4,5,"鄭寶清",44/1/10,"男","桃園市","民主進步黨","國立中央大學管理學博士
國立中興大學法學碩士
國立中興大學公共行政系學士","第三、四、九屆立法委員
民進黨立法院黨團總召集人
行政院陸委會諮詢委員
第二屆國大代表、主席團主席
台鹽公司董事長
桃園航空城董事長
崇右科大教授、副校長
開南大學教授
民進黨中執委、中常委
民進黨桃園縣黨部主委"
"桃園市",5,1,"呂玉玲",50/6/19,女,"桃園市","中國國民黨","中原大學商學院企業管理
學系碩士。桃園創新技術
學院企業管理系。育達商
職。中壢國中。中壢國小。","第八、九屆立法委員。珍珠國際同
濟會第十屆會長。婦聯青溪桃園縣
支會主任委員。桃園市守望相助大
隊平鎮中隊中隊長。國立中央大學
客家書院執行委員。平鎮市社區營
造協會理事長。平鎮市體育會理事
長。桃園縣平鎮市婦女會理事長。"
"桃園市",5,2,"劉芳萍",45/10/22,女,"臺北市","勞動黨","1980 年中興大學公共行政
系畢業","1988 年正式踏入勞工服務行列，任
勞動人權協會幹事。
1989-1991 任勞動黨桃竹苗勞服中
心總幹事。
1992-1994 任勞動倫理基金會董事。
1993-2000 任彰化縣木工業職業工會
秘書兼木工會全國聯合會總幹事。
2001-2019 接手桃園市新世紀愛鄉
協會勞工服務工作。
2006-2019 任桃園市政府勞資爭議
調解委員。"
"桃園市",5,3,"張誠",49/6/2,"男","臺北市","國會政黨聯盟","美國伊利諾大學香檳校區
電腦科學 博士
清華大學 計算機管理決策
研究所 碩士
國防大學 中正理工學院
應用數學系 學士","國立中央大學企管系 兼任助理教
授
台北市榮譽觀護人協進會 副理事
長
解癮戒毒協會 副理事長
中華民國中央軍校校友總會 監事
中山科學研究院 雄風三型飛彈 上
校總工程師
美國太空總署(NASA) 反物質磁譜
儀 研究專員
( 主持人: 丁肇中)"
"桃園市",5,4,"易乃文",51/8/26,"男","桃園市","無","桃園市潛龍國小
桃園市龍潭國中
中正預校
嶺東科技大學國際企業研
究所碩士
國立彰化師範大學工業教
育與技術學系博士","陸軍軍官學校
三軍大學陸軍學院
國防大學戰爭學院
陸軍排連營長
國防大學陸軍學院教官
成功嶺上校旅長
南部地區後備指揮部副指揮官
高鼎人力公司總經理室特助／彰化
分公司經理
臺中監獄教誨志工老師
臺中江西同鄉會理事長"
"桃園市",5,5,"蔣絜安",57/7/7,女,"苗栗縣","民主進步黨","東吳大學中文系
臺大國家發展研究所法學
碩士
中央大學客家學院社會科
學碩士","中央大學客家學院客家研究博士班
中廣、華視、民視等媒體記者、主
播、主持人、國際拼布藝術創作家
客家委員會諮詢委員、客語薪傳師
桃園市政府客家事務局局長、立法
院第九屆民進黨不分區立法委員
國會評鑑三項優質委員
客委會一等客家事務專業獎章"
"桃園市",6,1,"陳學聖",46/9/28,"男","臺北市","中國國民黨","建國中學；台大政治系學
士；淡江大學中國大陸研
究所碩士","中華日報、中國時報記者；亞洲電
台資深主持人；第六、七屆台北市
議員；桃園縣政府文化局長；中國
國民黨中常委；中國國民黨桃園縣
黨部主委；第四、五、八、九屆立
法委員"
"桃園市",6,2,"趙正宇",55/3/29,"男","桃園市","無","銘傳大學公共事務學碩士","●公所秘書
●市民代表
●桃園縣第15、16、17 屆縣議員
●桃園市第1 屆市議員
●立法院第九屆立法委員"
